{
  "snapshot_ref": "snp_3XJVJR46YD0KAJZA0DAV1M2Y57",
  "pipeline_version": "doc.pdf-text-reviewed@0.1.0",
  "media_type": "application_pdf",
  "source_url": "https://njggzy.nanjing.gov.cn/njweb/uploadfile/9455c8ad-5fb9-483a-bae3-6cd6d4193526/【中标结果公示】二次供水设备采购及相关服务成交结果公告.pdf",
  "blocks": [
    {
      "index": 0,
      "kind": "paragraph",
      "text": "二次供水设备采购及相关服务中标结果公示\n（招标编号：XZP2024121600042）\n一、中标人信息：\n二次供水设备采购及相关服务:\n中标人：上海上源泵业制造有限公司 其他报价：详见其他\n二、其他：\n二次供水设备采购及相关服务中标候选人公示已结束，现将中标结果公示如下:：\n中标人1：上海上源泵业制造有限公司，投标报价：年单价合计299.5118万元，项目负\n责人：杨曙；\n中标人2：上海熊猫机械（集团）有限公司，投标报价：年单价合计299.3784万元，项\n目负责人：邵永刚；\n中标人3：山东华立供水设备有限公司，投标报价：年单价合计285.873875万元，项目\n负责人：路晓亮；\n中标人4：上海泰普克科技有限公司，投标报价：年单价合计287.2795万元，项目负责\n人：余文静；\n中标人5：奥利机械（集团）有限公司，投标报价：年单价合计299.3368万元，项目负\n责人：徐曙华；\n服务期：730天；\n中标签约价：年单价合计294.2766万元。\n（本项目为固定全费用综合单价合同，每项货物的合同单价取全部中标人该项货物投标\n报价的平均值（四舍五入保留到个位数，单位:元））\n2025年1月21日\n三、监督部门\n本招标项目的监督部门为南京远古水业股份有限公司。\n四、联系方式\n招 标 人： 南京远古水业股份有限公司\n地 址： 南京市六合区新华西路70号\n联 系 人： 高工\n电 话： 15996332209\n电 子 邮 件： /\n招 标 代 理 机 构： 南京江北公用建设工程有限公司\n地 址： 南京市江北新区智达路6号智能制造产业园一号楼",
      "page": 1
    },
    {
      "index": 1,
      "kind": "paragraph",
      "text": "联 系 人： 姜工 13814177804\n电 话： 18013301591\n电 子 邮 件： /\n招标人或其招标代理机构主要负责人（项目负责人）：[*签名处*]（签名）\n招标人或其招标代理机构：[*盖章处*]（盖章）",
      "page": 2
    }
  ]
}
